"第2層","第2層説明","査読への返答","A","B","C","D","E","F","G","H","I"
"信頼","誠実に振る舞い、自ら省察し、患者の自律性を尊重するとともに、説明責任を果たす。","","","","","","","","","",""
"思いやり","品格と礼儀を持って、他者を適切に理解し、思いやりを持って接する。","","","","","","","","","",""
"社会正義","社会的公正を実現する。","","","","","","","","","",""
"全人的な視点とアプローチ","患者の抱える問題を臓器横断的だけでなく心理・社会的視点で捉え、専門領域にとどまらない姿勢で責任をもって診療に関わり、最善の意思決定や行動科学に基づく臨床実践に関与できる。","","","","","","","","","",""
"地域の視点とアプローチ","地域の実情に応じた医療・介護・保健・福祉の現状及び課題を理解し、医療の基本としてのプライマリ・ケアの実践、ヘルスケアシステムの質の向上に貢献するための能力を獲得する。","","","","","","","","","",""
"人生の視点とアプローチ","患者・生活者の成長、発達、老化、死のプロセスを踏まえ、経時的に患者・家族・生活者に起こり得る精神・社会・医学的な問題に関与できる。","","","","「精神・社会・医学的な」という並べ方にやや違和感があります。医学的・非医学的に関わらず（医学か医学でないかという目線ではなく）、他とあわせて「身体・心理・社会的な」問題とするほうがよいのではないでしょうか。","","","","","",""
"社会の視点とアプローチ","文化的・社会的文脈のなかで生成される健康観や人びとの言動・関係性を理解し、文化人類学・社会学(主に医療人類学・医療社会学)の視点から、それを臨床実践に活用することができる。","","","","","","","","","",""
"医療の質と患者安全","医療の質と患者安全の観点で自己の行動を省察し、組織改善と患者中心の視点を獲得する。","","","","","","","","","",""
"生涯学習","生涯学び続ける価値観を形成する。","","","","","","","","","",""
"医療者教育","医師・医学生に限らず同僚や後輩を含む医療者への教育に貢献する。","","","","あえて「他職種」を避けていますか？「同僚」に誰が含まれるのか、先輩は入らないのか（学習する組織としての視点はいらないのか）といった認識の違いが読者によっておこりそうなので、「医師・医学生に限らず、他職種を含む医療者への教育に貢献する」のほうが明確ではあります。","","","","","",""
"リサーチマインド","","","","","","","","","","",""
"既知の知","","","","","","","","","","",""
"研究の実施","","","","","","","","","","",""
"研究の発信","","","","","","","","","","",""
"研究倫理","","","","","","","","","","",""
"基礎医学","","","","","","","","","","",""
"人体各器官の正常構造と機能、病態、診断、治療","","","","","","","","","","",""
"全身に及ぶ生理的変化、病態、診断、治療","","","","","","","","","","",""
"情報・科学技術に向き合うための倫理観とルール","医療や研究等の場面で、情報科学技術を取り扱う際に必要な倫理観・デジタルプロフェッショナリズム・及び基本的原則を理解する。","","","","","","","","","",""
"医療とそれを取り巻く社会に必要な情報・科学技術の原理","安全かつ質の高い医療・医学研究に必要な情報・科学技術に関する基本理論を理解し、その知識を自身の学習や医療への適応する姿勢を体得する。","","","","","","","","","",""
"診療現場における情報・科学技術の活用","遠隔医療を含む患者診療、及び学習の最適化に有効なICTツールの実践スキル、デジタルコミュニケーションスキルを修得する","","","","","","","","","",""
"患者の情報収集","患者本人、家族、医療スタッフなど関係する様々なリソースを活用し、診療に必要な情報を収集できる。","","","","","","","","","",""
"患者情報の統合、分析と評価、診療計画","得られたすべての情報を統合し、様々な観点から分析し、必要な医療について評価した上で提供すべき医療を計画できる。","","","","","","","","","",""
"治療を含む対応の実施","患者の状態の評価に基づいて患者本人、家族、医療スタッフと連携し、必要な医療を提案または実施できる。","","","","","","","","","",""
"診療経過の振り返りと改善","実施された医療を省察し、言語化して他者に説明し、次回に向けて改善につなげることができる。","","","","","","","","","",""
"患者に接する言葉遣い・態度・身だしなみ・配慮","患者のプライバシー、苦痛などに配慮し、非言語コミュニケーションを含めた適切なコミュニケーションスキルにより良好な人間関係を築くことができる。","","","","","","","","","",""
"患者の意思決定の支援とそのための情報収集・わかりやすい説明","患者や家族の多様性に配慮し、必要な情報についてわかりやすく説明を行い、患者の主体的な治療やマネジメントに関する最善の意思決定を支援することができる。","","","","「主体的な」がどこにかかるかがわかりにくいので、「治療やマネジメントに関する患者の主体的な最善の意思決定を支援することができる。」ではどうでしょうか。","","","","","",""
"患者や家族のニーズの把握と配慮","患者や家族の心理的、社会的背景を広い視野で捉える姿勢を持ち、患者の持つ困難や必要な情報提供に対応することができる。","","","","「患者の困難や情報提供の必要性に対応することができる」","","","","","",""
"連携の基盤となるアプローチ","患者や利用者、家族、地域の重要な課題について、協働する関係者と共通の目標を設定する過程で、背景が異なることに互いに配慮し、役割、知識、意見、価値を伝え合うことができる。","","","","","","","","","",""
"連携に必要となるアプローチ","自他の役割や思考・行為・感情・価値観を踏まえ、協働する職種で信頼関係を構築し、時に生じる職種間の葛藤にも適切に対応しながら、 互いの知識・技術を活かし合い、職種としての役割を全うできる。","","","","","","","","","",""
"社会保障","憲法で定められた「生存権」を守る社会保障制度、公衆衛生とは何か、地域保健、産業保健、健康危機管理を理解する。保健統計の意義・利用法を学ぶ。","","","","","","","","","",""
"疫学・医学統計","人間集団を対象とする研究法である疫学の考え方と意義、主な研究デザインを学ぶ。医学、生物学における統計手法の基本的な考え方を理解する。","","","","","","","","","",""
"法医学","死の判定や死亡診断と死体検案を理解する。","","","","","","","","","",""
"","","","","","","","","","","",""
"社会の構造や変化から捉える医療","患者の抱える健康に関する問題の背景にある社会的な課題を適切に捉え、その解決のために積極的に行動する。","","","","","","","","","",""
"国内外の視点から捉える医療","国内、及び、国際社会の中で規定される医療の役割と医療体制について概説できる。","","","","","","","","","",""
"社会科学の視点から捉える医療","医学的・文化的・社会的文脈のなかで生成される健康観や人びとの言動・関係性を理解し、社会科学 (主に医療人類学・医療社会学)の視点・理論・方法から、それを臨床実践に活用することができる。","査読の返答ではありませんが、視点だけでは不十分であり、他の第4層にも影響するため、理論・方法を追記しました。","","","","","","","","",""
